Source_ID,data_id_code,search_type,entry_date,analyst_id,title,language,abstract,detailed_description,provider,dataset_citation,published_year,data_public,contact_name,contact_email,licence,licence_link,private_dataset_link,URL,DOI,...21,GET_alignment_firstpass,GET_efg_tag,domain_class,nationally_endorsed,stage1_comments,stage_1_pass,documentation_provided,year_start,year_end,band_layer_name,n_map_classes,file_type,vector_raster,min_source_resolution,max_source_resolution,minimum_mapping_unit,data_type,validated,validation_type,validation_methods,min_accuracy_pc,max_accuracy_pc,validation_ref,stage2_comments,stage_2_pass
73,bccr_global_surfwat_2023,active,13/05/2024,Naema_GrosDubois,Surface Area of River and Lakes (SARL),english,"The dataset has been developed by classifying changing water levels of riverine or lacustrine environments based on the extent of river channel belts. Riverine waterbodies represent both river channels as well as smaller oxbow/billabong lakes that have previously been associated with a river system as defined by the river channel belt extent. Lakes represent waterbodies outside the channel belt and include both natural and man-made reservoirs as well as wetlands and floodplain regions. 

Permanent waterbodies represent at least 12 months of water occurrence annually (or 100% of available pixels) based on the archive on Landsat imagery. Seasonal waterbodies represent at least 1 month of water occurrence but less than 12 months annually (or 100% of available pixels)","The raster dataset is provided as a 38-band raster in 10-degree cloud-optimized GeoTIFF files in a WG84 projection. Each raster band corresponds to one year ranging from 1984 until 2022. The files
are subdivided into 8 folders starting with the naming convention SARL_x.zip.",Bjerknes Centre for Climate Research; University of Bergen; USGS; 7Analytics,"Nyberg, B. (2023). Surface Area of River and Lakes (SARL) (1.0) [Data set]. Zenodo.; Nyberg, B., Sayre, R., and Luijendijk, E.: Increasing seasonal variation in the extent of rivers and lakes from 1984 to 2022, Hydrol. Earth Syst. Sci., 28, 1653–1663, 2024. (supporting paper)",2023,TRUE,Björn Nyberg,bjorn.burr.nyberg@gmail.com,CC BY 4.0 LEGAL CODE,https://creativecommons.org/licenses/by/4.0/legalcode,NA,https://zenodo.org/records/6895820,https://zenodo.org/doi/10.5281/zenodo.6895819,NA,FALSE,Various,Global,NA,Classification scheme too broad to crosswalk to EFG level,FALSE,NA,NA,NA,NA,NA,NA,NA,NA,NA,NA,NA,NA,NA,NA,NA,NA,NA,NA,NA
74,usda_baham_dryfor_2010,active,08/05/2024,Naema_GrosDubois,"Mapping tropical dry forest height, foliage height profiles and disturbance type and age with a time series of cloud-cleared Landsat and ALI image mosaics to characterize avian habitat",english,"Remote sensing of forest vertical structure is possible with lidar data, but lidar is not widely available. Here we map tropical dry forest height (RMSE=0.9 m, R2=0.84, range 0.6–7 m), and we map foliage height profiles, with a time series of Landsat and Advanced Land Imager (ALI) imagery on the island of Eleuthera, The Bahamas, substituting time for vertical canopy space. We also simultaneously map forest disturbance type and age. We map these variables in the context of avian habitat studies, particularly for wintering habitat of an endangered Nearctic-Neotropical migrant bird, the Kirtland's Warbler (Dendroica kirtlandii). We also illustrate relationships between forest vertical structure, disturbance type and counts of forage species important to the Kirtland's Warbler. The ALI imagery and the Landsat time series are both critical to the result for forest height, which the strong relationship of forest height with disturbance type and age facilitates. Also unique to this study is that seven of the eight image time steps are cloud-cleared images: mosaics of the clear parts of several cloudy scenes. We created each cloud-cleared image, including a virtually seamless ALI image mosaic, with regression tree normalization. We also illustrate how viewing time series imagery as red–green–blue composites of tasseled cap wetness (RGB wetness composites) aids reference data collection for classifying tropical forest disturbance type and age. Our results strongly support current Landsat Program production of co-registered imagery, and they emphasize the value of seamless time series of cloud-cleared imagery.",NA,US Department of Agriculture; Colorado State University; Miami University; The Nature Conservancy,"Helmer, E.H., Ruzycki, T.S., Wunderle Jr, J.M., Vogesser, S., Ruefenacht, B., Kwit, C., Brandeis, T.J. and Ewert, D.N., 2010. Mapping tropical dry forest height, foliage height profiles and disturbance type and age with a time series of cloud-cleared Landsat and ALI image mosaics to characterize avian habitat [dataset]. Remote sensing of Environment, 114(11), pp.2457-2473.",2010,FALSE,Eileen Helmer,eileen.helmer@usda.gov,Unknown,NA,NA,https://data.fs.usda.gov/research/pubs/iitf/ja_iitf_2010_helmer001.pdf,NA,NA,TRUE,T1.2,Regional,NA,Follow up on dataset and licence required,REVIEW,NA,NA,NA,NA,NA,NA,NA,NA,NA,NA,NA,NA,NA,NA,NA,NA,NA,NA,NA
75,usda_nscamer_cldfor_2019,active,08/05/2024,Naema_GrosDubois,"Cloud forest data for ""Neotropical cloud forests and páramo to contract and dry from declines in cloud immersion and frost""",english,"This data publication includes all cloud forest data for Helmer et al. (2019) ""Neotropical cloud forests and páramo to contract and dry from declines in cloud immersion and frost"". Data include 7 raster digital datasets representing ecoregions; minimum frost frequency defining lower boundary for subalpine or mixed TMCF (transitional to alpine or other higher elevation vegetation); minimum frost frequency defining lower boundary for alpine or other higher elevation vegetation, including páramo; minimum relative humidity (RH), to qualify as cloud forest, based on RH of the points calibrating the model of cloud forest minimum elevation; watershed delineations used to estimate maximum watershed elevation and relative humidity from 100 to 150 meters elevation at mountain bases; region in the model of cloud forest minimum elevations; and forest type (Neotropical montane cloud forest, subalpine or mixed cloud forest, or páramo/other vegetation). Data also include 4 raster digital datasets representing projected zone (alpine, subalpine/mixed, or montane) and change in relative humidity for Representative Concentration Pathway (rcp) 4.5 for average year 2050 and 2070, as well as for rcp 8.5 for average year 2050 and 2070.",NA,US Department of Agriculture; Ecological Research Support Houghton; Colorado State University,"Helmer, Eileen H.; Gerson, Elizabeth A.; Baggett, L. Scott; Bird, Benjamin J.; Ruzycki, Thomas S.; Voggesser, Shannon M. 2019. Cloud forest data for ""Neotropical cloud forests and páramo to contract and dry from declines in cloud immersion and frost"". Fort Collins, CO: Forest Service Research Data Archive. https://doi.org/10.2737/RDS-2019-0008",2019,TRUE,Eileen Helmer,eileen.helmer@usda.gov,Custom,NA,NA,https://www.fs.usda.gov/rds/archive/Catalog/RDS-2019-0008,https://doi.org/10.2737/RDS-2019-0008,NA,TRUE,T1.3,Continental,NA,NA,TRUE,NA,NA,NA,NA,NA,NA,NA,NA,NA,NA,NA,NA,NA,NA,NA,NA,NA,NA,NA
76,tnc_baham_veg_2024,active,08/05/2024,Naema_GrosDubois,The Bahamas - Vegetation,english,"This data layer was compiled for a protected area gap assessment for the Bahamas. This project identified critical conservation targets and threats for these countries working with existing data layers from local governments filling data gaps through data creation through digitizing off high-resolution imagery. The objectives were to a) Develop a GIS-based geographic extent of the study area based, but not limited to, bathymetry, and other physiographic factors; b) Compile all existing GIS data layers for all terrestrial, freshwater, and marine biological conservation targets and socioeconomic threats; c) Analyze existent GIS data layers, identify gaps and fill them by creating data from primary image sources; d) Produce a final geodatabase and associated metadata.",NA,The Nature Conservancy,"The Nature Conservancy (2024), The Bahamas - Vegetation [dataset], available from: https://caribbeanscienceatlas.tnc.org/datasets/TNC::the-bahamas-vegetation/about (accessed 08/05/2024)",2024,TRUE,TNC’s Caribbean Program GIS data manager (for permission); Denise Perez (associated with dataset),caribgis@tnc.org; denise.perez@tnc.org,Creative Commons Attribution-Noncommercial-Share Alike 3.0 License in addition to custom data use restrictions as per site,https://caribbeanscienceatlas.tnc.org/datasets/TNC::the-bahamas-vegetation/about,NA,https://caribbeanscienceatlas.tnc.org/datasets/TNC::the-bahamas-vegetation/about,NA,NA,TRUE,Various,Bahamas,NA,Complex licence needs review,REVIEW,NA,NA,NA,NA,NA,NA,NA,NA,NA,NA,NA,NA,NA,NA,NA,NA,NA,NA,NA
77,tnc_caribb_veg_2023,active,08/05/2024,Naema_GrosDubois,Vegetation Land cover in the Insular Caribbean 1999,english,"Improved conservation of the distinct natural vegetation types that occur on Caribbean islands is greatly facilitated if these vegetation types are accurately understood, described, and mapped in a manner that is accepted and respected by the diversity of countries, cultures, and peoples that make up the Caribbean today. The Caribbean Vegetation Classification and Atlas Project has been a key step towards characterizing the natural vegetation and landcover of the region, island-by-island, based on a newly derived standardized vegetation and classification system. This Project has involved the following key steps: - review of existing vegetation classification efforts - convening of a Caribbean Vegetation Ecology Working Group - development of a Standard Classification System for the Caribbean - production of a Vegetation and Landcover Atlas following the newly derived standard classification system

After an exhaustive review of existing vegetation classification systems, a standardized vegetation classification system was developed and set of maps which characterize the vegetation types of the Caribbean in a scientifically consistent manner.","A total of 104 vegetation formations were recognized for the Caribbean region—24 of which are new to the ICEC system. These 104 units are estimated to cover about 95% of the theoretical total number of vegetation formations potentially existing in the Caribbean islands. Descriptions of the Caribbean vegetation formations were developed, arranged with respect to their subordinate position within each major category of the ICEC system. Each standard term corresponding to a formation was accompanied by a short, abbreviated name both in English and Spanish, to be used as a mapping label. The most important formations—according to this new Caribbean system—were crosslisted with their equivalent vegetation units used in previous local or regional classification systems in the Caribbean, and a table with 438 components was developed. This effort, presented in Chapter Four, reconciled 21 of the most important vegetation systems used throughout the Caribbean islands.

A detailed, preliminary system of classification of the vegetation communities of the Caribbean Islands at the more precise alliances and associations level was also developed. Given the complexity of an archipelago that is considered one of the richest in the world in terms of plants species and communities, this was an extraordinary task. The new Caribbean vegetation system, based upon FGDC's classification standards recognized, named, and described 187 alliances. In addition, 199 associations were recognized and named. More than 90% of the associations were also briefly described, based onthe knowledge of the Vegetation Ecology Experts Working Group (See Appendix Three). This classification effort is estimated to have included about 50% of the theoretical total number of vegetation alliances and about 30% of all associations present in the Caribbean islands, many of which are still to be defined, named, and described. We estimate that there are about 350 vegetation alliances and 750 to 800 vegetation associations for the West Indian Islands",The Nature Conservancy,"The Nature Conservancy (2023), Vegetation Land cover in the Insular Caribbean 1999 [dataset], available from: https://caribbeanscienceatlas.tnc.org/datasets/TNC::vegetation-land-cover-in-the-insular-caribbean-1999/about (accessed 08/05/2024)",2023,TRUE,TNC’s Caribbean Program GIS data manager (for permission),caribgis@tnc.org,Creative Commons Attribution-Noncommercial-Share Alike 3.0 License in addition to custom data use restrictions as per site,https://caribbeanscienceatlas.tnc.org/datasets/TNC::vegetation-land-cover-in-the-insular-caribbean-1999/about,NA,https://caribbeanscienceatlas.tnc.org/datasets/TNC::vegetation-land-cover-in-the-insular-caribbean-1999/about,NA,NA,TRUE,Various,Regional,NA,Complex licence needs review,REVIEW,NA,NA,NA,NA,NA,NA,NA,NA,NA,NA,NA,NA,NA,NA,NA,NA,NA,NA,NA
78,usda_virgisl_lcov_2021,active,07/05/2024,Naema_GrosDubois,Virgin Islands land cover and forest structure,english,"This data publication contains five raster datasets detailing the land cover and forest structure of the United States Virgin Islands and British Virgin Islands. There are two spatial land cover datasets, provided in multiple formats, that represent land-cover and woody vegetation formations using multi-part Landsat ETM+ scenes centered around the year 2000. Also included is a digital elevation model (DEM) that was created using discrete lidar data collected in 2004. The DEM was created by filtering ground (minimum elevation) and non-ground (mean and maximum elevation) returns to create a bare earth DEM and forest height estimates for the islands of St. John and St. Thomas, United States Virgin Islands. Two additional raster datasets include models that displays the spatial representation of lidar derived (1) dominant co-dominant tree height estimates and (2) above ground biomass estimates for the islands of St. John and St. Thomas, United States Virgin Islands.","Process Steps for Virgin_Islands_Land_Cover files: IITF_JRS02_usbvi_landcov1*.* and IITF_JRS02_usbvi_landcov2*.*

We classified multi-part Landsat ETM+ imagery scenes that were pan-sharpened for the year 2000. Cloudy parts of the reference dates for each scene were replaced by image data from cloud-free parts of other image dates. Scene parts for non-reference dates had been radiometrically matched to reference dates for each scene with regression tree models, and cloud-filled scenes were radiometrically matched to each other with histogram matching. The imagery scenes and extents included the following:

Path / Row / Scene / Mosaic
4 / 47 / p004r047_20000327 / Base
3 / 47 / p003r047_20011102 / Match
4 / 47 / p004r47_19990917 / Match
4 / 47 / p004r47_20000802 / Match
4 / 47 / p004r47_20010125 / Match
4 / 48 / p004r48_20000327 / Base
4 / 48 / p004r48_20010125 / Match

Ancillary data were combined with satellite imagery to create an island-wide predictor variable dataset for image classification. Topographic variables, derived from USGS 30 m digital elevation models (DEM) included elevation, slope, aspect, curvature and facet. Climatic variables included mean annual precipitation and temperature. Vector derived variables included distance to roads, distance to streams (ghuts) and distance to coastlines. Finally, band indices and ratios were created from the Landsat image bands to produce the normalized difference vegetation index (NDVI) and the 4/5 band ratio. The ancillary predictor data were spatially co-registered with the cloud free image mosaics for the two time periods and stacked with the native Landsat reflectance bands 1-5 and 7 at a spectral resolution of 15 m, resulting in a 18 band image for each classification time period.

Field reference surveys were performed during a reconnaissance visit in 2004 to collect training and reference data. The island wide field surveys and expert consultation with regional vegetation experts enabled us to discern land cover attributes and forest formation from 1 m IKONOS panchromatic sharpened imagery and 1 m color DOQQs. Land-cover and forest formation were then identified in the satellite imagery based on a comparison to areas interpreted in reference imagery and the spatial location of field reference survey data. Forest formation was identifiable in both the reference imagery and the Landsat imagery by a number of factors including spectral components such as color, contrast, tone and texture as well as spatial indicators including geology and elevation. Difficulties distinguishing forest formation were encountered in transitional areas including semi-deciduous and seasonal evergreen forest. Field survey data collected meeting this criteria proved useful in the identification of uncertain forest transitions.

The decision tree classifier See5 (www.rulequest.com) was used for landcover and forest formation classification of Landsat ETM+ imagery for the year 2000. Training data polygons for each land-cover and land-use class were converted to an ASCII point file providing spatial coordinates, class name and assigned class number. The classification was performed with a 10 trial adaptive boosting option to improve the overall accuracy by combining many decision trees into a single combined classifier. This process provides more predicted data to analyze before determining each final class (www.rulequest.com). The default global pruning option was also used to reduce the likelihood of over fitting the tree to the training data. The pruning process removes predicted parts of the decision tree with relatively high error rates and makes decisions as to the final class assignment.

Manual edit confused classes using 1 m IKONOS multispectral imagery and 1 m DOQQ reference data.

Manually digitize areas where remaining cloud and cloud shadow artifacts exist in image mosaics.

A stratified random sample generated approximately 50 validation points for each landcover class. The 1 m IKONOS imagery (dates ranging from 2000 to 2003) and DOQQ (2004) data were used to verify the accuracy assessment points for each class in the classified images. Using high resolution imagery to validate the classification eliminated restrictions on point locations, permitting us to include points that would otherwise not be accessible because of topography, remoteness, or property ownership. An error matrix was produced for each mapped class that estimates the overall percentage of correctly classified pixels, producer and user's accuracies, and the kappa coefficient.",US Department of Agriculture; Colorado State University,"Kennaway, Todd A.; Helmer, Eileen H.; Lefsky, Michael A.; Brandeis, Tom J.; Sherrill, Kirk R. 2021. Virgin Islands land cover and forest structure. Fort Collins, CO: Forest Service Research Data Archive.",2021,TRUE,Eileen Helmer,eileen.helmer@usda.gov,Custom,NA,NA,https://www.fs.usda.gov/rds/archive/Catalog/RDS-2021-0091,https://doi.org/10.2737/RDS-2021-0091,NA,TRUE,Various,Regional,NA,NA,TRUE,NA,NA,NA,NA,NA,NA,NA,NA,NA,NA,NA,NA,NA,NA,NA,NA,NA,NA,NA
79,aafc_can_agri_2023,active,29/04/2024,Naema_GrosDubois,Annual Crop Inventory - Canada,english; french,"Understanding the state and trends in agriculture production is essential to combat both short-term and long-term threats to stable and reliable access to food for all, and to ensure a profitable agricultural sector. Starting in 2009, the Earth Observation Team of the Science and Technology Branch (STB) at Agriculture and Agri-Food Canada (AAFC) began the process of generating annual crop type digital maps. Focusing on the Prairie Provinces in 2009 and 2010, a Decision Tree (DT) based methodology was applied using optical (Landsat-5, AWiFS, DMC) and radar (Radarsat-2) based satellite images. Beginning with the 2011 growing season, this activity has been extended to other provinces in support of a national crop inventory. To date this approach can consistently deliver a crop inventory that meets the overall target accuracy of at least 85% at a final spatial resolution of 30m (56m in 2009 and 2010).","For 15 years the Earth Observation Team of Agriculture and Agri-Food Canada (AAFC) has been mapping crop types of individual fields in Canada. They developed an operational software system to decipher crop types using satellite observations and trustworthy ground information. Successful crop identification relies on image acquisitions from multiple sensors during key crop phenological stages (reproduction, seed development and senescence). 

Multi-temporal optical data are the primary data source for crop classification because the NIR/SWIR channels are vital to crop classifications. Over a growing season, a minimum of three optical images are required to successfully identify crops. To the optical data, c-band radar data is added to help with physical plant structures and moisture measurements. In 2009 and 2010 the ScanSAR mode of RADARSAT-2, with its large swath (300 km) and moderate resolution (50 m), was used as it fits the agricultural landscape of the Prairie Provinces. From 2011-2019, the finer resolution of RADARSAT2’s Wide mode (30 m) was used, as it is better suited to the smaller fields in the rest of Canada. This finer resolution SAR data continues today with 30m Compact-Pol data from RCM. 

Annual crop insurance data are the most accurate, detailed and complete sources of information for crop types in Canada. As such, AAFC has agreements with some provincial crop insurance agencies to use their data for the training and validation of the classification process. For provinces where insurance data cannot be accessed, ground-truth information is provided by point observations from AAFC staff or other provincial sources. Each year, AAFC staff collects tens of thousands of points identifying crops across the country. These point sources are combined and used as training or reference sites as well. 

The training and validation data used to classify non-agricultural land cover types comes from numerous Land Cover / Land Use products, including the AAFC semi-decadal land use time series. Point data are taken from these products and adjusted (eliminating any that were in transitions areas between classes or in areas of high potential change (i.e. near urban expansion)). What remains is a stable series of known land cover points for the following classes: water, barren, urban, shrubland, wetland, grassland, agriculture (generalized), and forest. 

Focusing on the Prairie Provinces in 2009 and 2010, a Decision Tree (DT) based methodology was applied using optical (Landsat-5, AWiFS, DMC) and radar (RADARSAT-2) imagery. The final map had a spatial resolution of 56m. 

For the 2011 and 2012 growing season, this activity was extended to all the other provinces (except Newfoundland) in support of a national crop inventory. The final spatial resolution was increased to 30m, to aid in differentiating the smaller fields in the rest of Canada.  For 2012, the lack of affordable optical data forced AAFC to rely mostly on RADARSAT-2 data. 

In 2013, this activity expanded to include Newfoundland for the first time, and move to Landsat-8 as its sole-source of optical imagery. RADARSAT-2 continued to be the source of radar imagery. This combination of optical and radar imagery had been repeated over the agricultural extent of Canada in the subsequent years, until 2016 when Sentinel-2 and Gaofen-1 optical imagery were added. The Gaofen imagery was dropped after the 2017 season. For the 2021 map, the RADARSAT Constellation Mission (RCM) satellites became the source of radar imagery. In 2022, Landsat-9 imagery was added to the optical collection. 

At present, this approach can consistently deliver a crop inventory that meets the overall target accuracy of at least 85% at a final spatial resolution of 30m. 

Note: At the national scale, the crop type legend is not homogeneous. In some provinces, such as Alberta, Saskatchewan, and Quebec, we have been able to divide the crop types in to sub-categories (i.e. winter versus spring wheat). For other provinces, those classes may not have been subdivided. A lack of training sites and, in some cases, a limited availability of spectral data does not allow for the differentiation of crops into sub-categories with sufficient precision. This can result in class discontinuities between provinces.",Agriculture and Agri-Food Canada,"Agriculture and Agri-Food Canada, 2023, “Annual SpaceBased Crop Inventory for Canada, 2023”, Agroclimate, Geomatics and Earth Observation Division, Science and Technology Branch. https://open.canada.ca/data/en/dataset/ba2645d5-4458-414d-b1966303ac06c1c9  (accessed 29/04/2024)",2023,TRUE,Agriculture and Agri-Food Canada,agri-geomatics-agrog@agr.gc.ca,Open Government Licence - Canada,https://open.canada.ca/en/open-government-licence-canada,NA,https://open.canada.ca/data/en/dataset/ba2645d5-4458-414d-b196-6303ac06c1c9,NA,NA,TRUE,Various,Canada,NA,NA,TRUE,NA,NA,NA,NA,NA,NA,NA,NA,NA,NA,NA,NA,NA,NA,NA,NA,NA,NA,NA
