Source_ID,data_id_code,search_type,entry_date,analyst_id,title,language,abstract,detailed_description,provider,dataset_citation,published_year,data_public,contact_name,contact_email,licence,licence_link,private_dataset_link,URL,DOI,...21,GET_alignment_firstpass,GET_efg_tag,domain_class,nationally_endorsed,stage1_comments,stage_1_pass,documentation_provided,year_start,year_end,band_layer_name,n_map_classes,file_type,vector_raster,min_source_resolution,max_source_resolution,minimum_mapping_unit,data_type,validated,validation_type,validation_methods,min_accuracy_pc,max_accuracy_pc,validation_ref,stage2_comments,stage_2_pass
1,uf_arctic_veg_2022,active,11/03/2024,Nicholas_Murray,Raster Circumpolar Arctic Vegetation Map Version 2,english,"The Circumpolar Arctic Vegetation Map (CAVM) shows the types of vegetation that occur across the Arctic—between the Arctic Ocean to the north and the northern limit of forests (“treeline”) to the south. Here, environmental and climatic conditions are extreme, with a short growing season and low summer temperatures.

The region supports plants such as dwarf shrubs, herbs, lichens and mosses, which grow close to the ground. As one moves southward, the amount of warmth available for plant growth increases , allowing the size, abundance, and variety of plants to increase. Other environmental controls, such as elevation, topography, soil chemistry, soil moisture, and the past history of plant colonization, also influence the distribution of plant communities. The colors on the map indicate the differences that occur in the outward appearance of vegetation.

An international team of Arctic vegetation scientists representing the six countries of the Arctic—Canada, Greenland, Iceland, Norway, Russia, and the United States—prepared the map. Methods, additional thematic maps, detailed descriptions of the 16 map units, and photos of representative plant communities and species are on the reverse side. Get a more detailed overview at About the CAVM.

The Raster Circumpolar Arctic Vegetation Map (Raster CAVM) map groups over 400 described plant communities into 16 vegetation types, glaciers, saline water, and freshwater at 1-km resolution. It builds on the strengths of the original CAVM, using the same legend, extent and projection, while providing a finer spatial resolution, raster format, and improved mapping of Arctic vegetation.","Land cover maps are the basic data layer required for understanding and modeling ecological patterns and processes. The Circumpolar Arctic Vegetation Map (CAVM), produced in 2003, has been widely used as a base map for studies in the arctic tundra  . However, the relatively coarse resolution and vector format of the map were not compatible with many other data sets. We present a new version of the CAVM, building on the strengths of the original map, while providing a finer spatial resolution, raster format, and improved mapping. The Raster CAVM uses the legend, extent and projection of the original CAVM. The legend has 16 vegetation types, glacier, saline water, freshwater, and non-arctic land. The Raster CAVM divides the original rock-water-vegetation complex map unit that mapped the Canadian Shield into two map units, distinguishing between areas with lichen- and shrub-dominated vegetation. In contrast to the original hand-drawn CAVM, the new map is based on unsupervised classifications of seventeen geographic/floristic sub-sections of the Arctic, using AVHRR and MODIS data (reflectance and NDVI) and elevation data. The units resulting from the classification were modeled to the CAVM types using a wide variety of ancillary data. The map was reviewed by experts familiar with their particular region, including many of the original authors of the CAVM from Canada, Greenland (Denmark), Iceland, Norway (including Svalbard), Russia, and the U.S. The analysis presented here summarizes the area, geographical distribution, elevation, summer temperatures, and NDVI of the map units. The greater spatial resolution of the Raster CAVM allowed more detailed mapping of water-bodies and mountainous areas. It portrays coastal-inland gradients, and better reflects the heterogeneity of vegetation type distribution than the original CAVM. Accuracy assessment of random 1-km pixels interpreted from 6 Landsat scenes showed an average of 70 % accuracy, up from 39 % for the original CAVM. The distribution of shrub-dominated types changed the most, with more prostrate shrub tundra mapped in mountainous areas, and less low shrub tundra in lowland areas. This improved mapping is important for quantifying existing and potential changes to land cover, a key environmental indicator for modeling and monitoring ecosystems.",University of Alaska Fairbanks,"Raynolds, Martha; Walker, Donald (2022), “Raster Circumpolar Arctic Vegetation Map”, Mendeley Data, V2",2022,TRUE,NA,NA,CC BY NC 3.0,https://creativecommons.org/licences/by-nc/3.0/,NA,https://data.mendeley.com/datasets/c4xj5rv6kv/2,https://doi.org/10.17632/c4xj5rv6kv.2,NA,TRUE,Various,Continental,NA,NA,TRUE,NA,NA,NA,NA,NA,NA,NA,NA,NA,NA,NA,NA,NA,NA,NA,NA,NA,NA,NA
2,aad_macqis_veg_2015,active,11/03/2024,Nicholas_Murray,Macquarie Island Vegetation and Drainage Structure Data Set,english,"The data for this map were collected as part of two ASAC projects - 488 and 956, of which Patricia Selkirk was the chief investigator. Macquarie Island (54 degrees S 159 degrees E) is a subantarctic island (c. 35km by 3 to 5km) approximately equidistant between Tasmania, New Zealand and Antarctica in the Southern Ocean. The vegetation is herbaceous, lacking shrubs and trees. Vegetation and drainage are mapped at a scale of 1:25 000 from field observations, satellite imagery and limited oblique and aerial photography. The categories adopted for mapping vegetation are based on attributes of foliage height and percentage foliage cover of the ground surface (vegetation structure), not on species distribution (floristics). The distribution of vegetation categories is strongly correlated with aspect, topography and rock type. Mires, streams and lakes form an intricate drainage pattern that is strongly influenced by the geology of this tectonically active emergent crest of the submarine Macquarie Ridge at the boundary of the Pacific and Australian plates. The drainage pattern of the whole island is represented in a map with substantially greater accuracy than in any previous map.","INTRODUCTION
The vegetation of Macquarie Island reflects its isolation in the Southern Ocean, low average summer temperature, extremely strong winds, and the island's geology and hydrology. The island, 34km north-south by 2-5km east-west, comprises an undulating plateau bounded by steep coast-facing slopes and cliffs. Drainage on the island is complex and, to date, poorly mapped. The balance between surface and underground flow of water has profound effects on streams, lakes and on the distribution of structural vegetation types.
Isolation and Flora. At 54° S 159° E Macquarie Island is approximately 1500km south east of Tasmania, 1000km south west of New Zealand. It is one of only seven subantarctic islands or island groups close to the Polar Front in the Southern Ocean. It has never been part of or close to a continental land mass. Its entire flora has arrived by long distance, over-ocean dispersal. The vascular plant flora is small, 46 species (Hnatiuk 1993), and shows strong similarities to the floras of other subantarctic islands, to New Zealand and , less strongly, to Australia (Selkirk et al 1990). Non-vascular plants constitute an important part of the Macquarie Island flora: 83 species of mosses, 51 species of liverworts (Selkirk et al 1990), 141 species of lichens (Kantvilas and Seppelt 1992), at least 400 species of non-marine algae (T.P. McBride pers. comm.).
Low average summer temperature. Substantial woody growth is commonly found where the average temperature for three summer months exceeds 10° C. In common with other subantarctic islands, summer temperature on Macquarie Island (6.7° C mean 1948-86, Jacka, Christou and Cook 1984) is such that little woody growth is produced. The largest terrestrial plants, the non-woody tussock grass, Poa foliosa and the forb Stilbocarpa polaris, reach about 1.5m tall. Most plants are non woody and shorter than about 0.3m, but three species, Coprosma perpusilla, Acaena magellanica and A. minor, produce woody creeping stems up to about 0.5cm diameter.
Strong winds. The severe climatic conditions result in a dynamic interaction between plants and landforms. Wind, snow, ice and water produce active erosion even on low slopes. Complex vegetation patterns occur over small distances, for example areas with high percentage of bare ground (feldmark) adjoin areas where the vegetation cover is complete.
Geology. In the northern third of the island is a large area where the extremely sparse vegetation is explained by the presence of rock types which produce soil unfavourable for plant growth (Adamson et al 1993). Most of the southern two thirds of the island is a thick pile of pillow lavas and pyroclastic rocks whose intense fracturing promotes rapid infiltration of water. Bedding and faulting influence the flow of groundwater. As a result, areas of groundwater intake are generally well drained, while areas of outflow have abundant mires.
Hydrology. Surface and underground flow of water is strongly influenced by geological features. Fault-bounded escarpments frequently control the direction of streams and location of lakes (Ledingham and Peterson 1984). Faults and fractures channel groundwater. Vegetation in lakes includes Myriophyllum triphyllum, various bryophytes, and abundant algae including at least 250 species of diatoms.
Bare ground. On steep slopes between the plateau (altitude 100-400m a.s.l) and the coast, and on the plateau itself, bare ground is common. Strong wind, rain, sleet, and snow cause abrasion of plants and the bare ground. The progressive accumulation of peat, even on gentle slopes, results in mass movement of soil and its vegetation (Selkirk 1996). The resultant scars are subject to accelerated erosion and slow colonisation (Scott 1985).
Nearshore marine vegetation. Offshore, the algal vegetation is dense. Brown algae grow to many metres in length. Southern kelps, particularly the bull kelp, Durvillaea antarctica, from the high tide limit to more than 15m depth, and Macrocystis pyrifera, form impressive masses of floating fronds, particularly prominent along the sheltered eastern coast. The great size of individual marine algal plants contrasts with the short stature of the terrestrial vegetation.
THE MAP
This map depicts, at a scale of 1:25 000, distribution of structural vegetation categories, with emphasis on height of the vegetation above the ground, and its density, defined as % of the ground surface covered by plants. The map does not show the distribution of species, nor does it attempt to establish and then map plant associations or comparable categories which reflect communities of plant species.
Taylor (1955) mapped the vegetation of the whole island at small scale (approx. 1:63000, i.e. 1 inch to the mile), and the northern quarter at approx. 1:22000, using four essentially structural categories: wet tussock, subglacial herbfield, feldmark, bare ground. In the text accompanying the map he took a phytosociological approach, dividing the Macquarie Island vegetation into five main formations: grassland, herbfield, fen, bog and feldmark. Within each formation he described one or more alliances, associations and sub-associations. Since his pioneering work some aerial photography and satellite imagery have become available, much additional field work has been done, and a fuller assessment is now possible of environmental controls. Copson (1984) plotted the distribution of vascular plant species for the whole island on a 1 km x 1 km grid, showing the wide distribution of many species.
In preparing this map, we have used as a basis the SPOT 3 merged pan/multispectral image of 22 December 1994 and the coastline prepared from this image by AUSLIG. We have consulted the black and white aerial photography of 6 and 7 February 1976, runs CAS 5465, CAS 8467 to 8473 and CAS 8480 to 8483. We have drawn extensively on our fieldwork and on our own and colleagues' field notes and photographs.
Although the present map is more detailed and at a larger scale than previous studies, it is preliminary. Its most important role is as a basis for more detailed work in the future. Detailed work is probably best carried out on carefully selected small areas of the island where mapping and other data gathering can be done at high resolution. Knowledge of the present vegetation is needed to assess the consequences of environmental change including the effects that the planned eradication of cats will have on burrow-nesting bird and rabbit populations, and in turn on vegetation.
The topographic map of Macquarie Island (Division of National Mapping 1971) is inaccurate with respect to the drainage system of lakes and streams (Selkirk and Adamson 1995). The map prepared by Blake in 1911-14 (Mawson 1943) is more accurate than the 1971 map. The geological maps of Macquarie Island (Tasmanian Geological Survey 1998) include more detailed representations of drainage than Blake's map or the topographic map. Although less detailed in places than the geological maps, the present map is in our view, more accurate in locating some stream and stream-lake connections. Definitive mapping of streams on Macquarie Island is yet to be done.
CATEGORIES AND THEIR TERMINOLOGY
Vegetation mapping categories were chosen to indicate foliage density and foliage height, similar to the scheme of Specht (Specht et al 1995), now widely adopted throughout Australia when mapping vegetation structure (AUSLIG 1990). It is appropriate to adopt Specht's boundary of 70% foliage projective cover of the ground in order to establish two categories, closed vegetation (foliage projective cover greater than 70%) and open vegetation (foliage projective cover less than 70%). Field checking showed that the SPOT imagery (22 December 1994) is a valuable aid in delineating boundaries between closed and open vegetation. Vegetation whose foliage stands higher than 0.4 to 0.5m above the ground is designated tall vegetation and it can be distinguished from short vegetation whose foliage is less than 0.4 to 0.5m in height.
The term herb is applied to vegetation containing herbaceous , i.e. essentially non-woody, species which includes monocotyledons (such as grasses and graminoids), dicotyledons (such as forbs), and ferns. The terms grass and grassland are not used, first because forbs and graminoids (such as sedges that are not in the grass family) are abundant in almost all areas of short herb vegetation, and second because in places where the tall tussock grass Poa foliosa is dominant it often forms complex mosaics with the large forb Stilbocarpa polaris so that this vegetation is categorised as closed tall herb vegetation, rather than tussock grassland.
 
The general term mire is applied to vegetation of waterlogged areas, in preference to the more restrictive terms bog or fen whose correct usage depends upon knowing attributes such as pH.
Each mapping unit identifies areas which, when examined at greater resolution, prove to be complex mosaics, some features of which are described below.
Vegetation cover 70% or greater (closed vegetation).
Closed tall herb vegetation, northern and eastern coast. The tall herbs are mainly the tussock grass Poa foliosa and the forb Stilbocarpa polaris but in restricted areas in valleys draining into Sandy Bay and Green Gorge, thickets of the fern Polystichum vestitum also occur. Poa foliosa and S. polaris may occur in almost monospecific stands, but they commonly occur together. The tall vegetation is absent on gentler slopes near the coast where drainage is poor, and on unstable surfaces such as active scree, outwash fans, and crumbling rocky outcrops. Closed tall herb vegetation also occurs on the western and southern steep coast-facing slopes below the plateau, but there it is included in the category 'vegetation on western and southern coast-facing slopes'. The category 'closed tall herb vegetation' covers Taylor's (1955) wet tussock grassland formation.
Closed short herb vegetation. This vegetation, commonly about 0.2m tall, provides near-complete or complete ground cover over large areas of the island, particularly on the plateau and in valleys that slope gently down towards the coast. This category, which can enclose small mires, also occurs on the eastern coast-facing slopes, particularly below the change of slope noted on the map. The floristic (species) composition is complex. It ranges from extensive stands of Acaena spp. that are almost monospecific to communities made up of most of the vascular species of the island. Sedge-like plants such as Luzula crinita are abundantly and widely distributed in this vegetation category.
Bryophytes make an important contribution to the total ground cover. The category 'closed short herb vegetation' includes most of Taylor's (1955) sub-glacial herbfield formation.
Closed vegetation on western and northern marine-cut platform. A wide gently sloping wave-cut platform fringes the northern and part of the western coast of the island. It is backed by steep slopes leading up to the plateau and is mantled by a complex mosaic of tall and short herb closed vegetation, mires and lakes. Some areas are dominated by bryophytes. The platform's low slope, with abundant precipitation and drainage from the plateau has led to waterlogging in many parts. The category 'closed vegetation on western and northern marine-cut platform' includes parts of Taylor's (1955) sub-glacial herbfield formation, and parts of his bog and fen formations.
Mire on the plateau. Mire vegetation in permanently saturated areas and infilled lakes is short and covers the ground completely. Bryophytes are frequently dominant. Mires occur in valley bottoms where slope angle is low, but where groundwater emerges they occur on quite steep surfaces in very localised areas. The category 'mire on the plateau' includes parts of Taylor's (1955) bog and fen formations.
Vegetation cover less than 70% (open vegetation).
Open short herb vegetation (and northern and eastern gullies). The pattern and proportions of bare ground and vegetation are extremely variable. There is commonly a mosaic of polygonal patches in which both the bare ground and the edges of the vegetated areas are subject to erosion. Also common are alternating stripes of vegetation and bare ground, often in the form of stepped benches or terraces. Bryophytes become dominant or codominant with angiosperms such as Azorella macquariensis in the most exposed places. This category includes the feldmark formation of Taylor (1955), and the sparse vegetation on unfavourable soils (Adamson et al 1993).
Vegetation on western and southern coast-facing slopes. This is a complex interdigitation of tall, short, closed and open vegetation with bluffs, cliffs and large active screes along the steep slopes below the plateau along the western and southern sides of the island. The mixture has been grouped as a complex rather than attempt its subdivision at this stage.
Vegetation cover c.0% (bare ground).
Large areas of bare ground devoid of bryophytes and vascular plants occur where penguins establish colonies, and where erosion is particularly active.


REFERENCES
Adamson, D.A., Selkirk, J.M. and Seppelt, R.D. 1993. Serpentinite, harzburgite and vegetation on subantarctic Macquarie Island. Arctic and Alpine Research 5:216-219. AUSLIG. 1990. Atlas of Australian Resources. Volume 6. Vegetation. Canberra: Australian Government Publishing Service. 64 pp.
Copson, G.R. 1984. An annotated atlas of the vascular flora of Macquarie Island ANARE Research Notes, 18: 1-70. Division of National Mapping. 1971. Macquarie Island, Tasmania 1: 50 000. Canberra, Australia.
Hnatiuk, R.J. 1993. Subantarctic Islands. Flora of Australia 50:53-62.
Jacka, T.H., Christou, L. and Cook, B.J. 1984. A data bank of mean monthly and annual surface temperatures for Antarctica, the Southern Ocean and the South Pacific Ocean. ANARE Research Notes, 23: 1-97.
Kantvilas, G. and Seppelt, R.D. 1992. The lichen flora of Macquarie Island: introduction and annotated checklist of species. ANARE Research Notes 87:1-20.
Ledingham, R. and Peterson, J.A. 1984. Raised beach deposits and the distribution of structural lineaments on Macquarie Island. Papers and Proceedings of the Royal Society of Tasmania, 118: 223-235.
Mawson, D. 1943. Macquarie Island: its geography and geology. Australasian Antarctic Expedition Scientific Reports Series A Vol V:1-193, plus 2 maps.
Scott, J.J. 1985. Effects of feral rabbits on the revegetation of disturbed coastal sites, Macquarie Island. Unpublished M.A. thesis, Monash University, Melbourne. 219pp. Selkirk, J.M. 1996. Peat slides on subantarctic Macquarie Island. Zeitschrift fuer Geomorphologie N.F. 105:61-72.
Selkirk, P.M. and Adamson, D.A. 1995. Mapping Macquarie Island. The Globe, Journal of the Australian Map Circle 41:53-67
Selkirk, P.M., Seppelt, R.D. and Selkirk, D.R. 1990. Subantarctic Macquarie Island: Environment and Biology. Cambridge: Cambridge University Press. 285 pp.
Specht, R.L., Specht, A., Whelan, M.B. and Hegarty, EE. 1995. Conservation Atlas of Plant Communities in Australia. Lismore: Centre for Coastal management and Southern Cross University Press.
Tasmanian Geological Survey. 1998. Geology of Macquarie Island, 1: 50 000. Data Management Group, Mineral Resources Tasmania. Tasmanian Geological Survey. 1998. Geology of Macquarie Island, 1: 25 000. Data Management Group, Mineral Resources Tasmania. Tasmanian Geological Survey. 1998. Geology of Macquarie Island, 1: 10 000. Data Management Group, Mineral Resources Tasmania. Taylor, B.W. 1955. The flora, vegetation and soils of Macquarie Island. ANARE Reports, Series B, Volume II, Botany. 192pp.",Australian Antarctic Data Centre (AADC),"Selkirk, P., Adamson, D. and Harris, U. (1999) Macquarie Island Vegetation and Drainage Structure Data Set, Ver. 1, Australian Antarctic Data Centre - https://data.aad.gov.au/metadata/MIvegmap, Accessed: 2024-03-12",2015,TRUE,NA,NA,CC BY 3.0 AU DEED,https://creativecommons.org/licences/by/3.0/au/,NA,https://data.gov.au/data/dataset/aad-mivegmap,NA,NA,TRUE,Various,Regional,NA,NA,TRUE,NA,NA,NA,NA,NA,NA,NA,NA,NA,NA,NA,NA,NA,NA,NA,NA,NA,NA,NA
3,bgis_safr_marine_2018,active,14/03/2024,Ben_Cresswell,2018 Beta Marine Ecosystem Map,english,"A revised marine ecosystem classification system and map of the distributions of 150 marine ecosystem types was produced in 2018. More than ten years of research was consolidated to inform the revised map. Updated biogeographic information was used to refine marine ecoregions, and sub-regions nested within ecoregions were introduced.","A revised marine ecosystem classification system and map of the distributions of 150 marine    ystem types was produced in 2018. More than ten years of research was consolidated to inform the revised map. Updated biogeographic information was used to refine marine ecoregions, and sub-regions nested within ecoregions were introduced.",South Africa National Biodiversity Institute,"South African National Biodiversity Institute. 2018 Beta Marine Ecosystem Map [Vector] 2018. Available from the Biodiversity GIS website, accessed on March 14, 2024",2018,NA,Kerry J. Sink,k.sink@sanbi.org.za,Custom,https://bgis.sanbi.org/Document/Download/5495,NA,https://bgis.sanbi.org/SpatialDataset/Detail/2681,10.3389/fevo.2023.1108118,NA,TRUE,Various,South Africa,TRUE,NA,TRUE,NA,NA,NA,NA,NA,NA,NA,NA,NA,NA,NA,NA,NA,NA,NA,NA,NA,NA,NA
