Source_ID,data_id_code,search_type,entry_date,analyst_id,title,language,abstract,detailed_description,provider,dataset_citation,published_year,data_public,contact_name,contact_email,licence,licence_link,private_dataset_link,URL,DOI,...21,GET_alignment_firstpass,GET_efg_tag,domain_class,nationally_endorsed,stage1_comments,stage_1_pass,documentation_provided,year_start,year_end,band_layer_name,n_map_classes,file_type,vector_raster,min_source_resolution,max_source_resolution,minimum_mapping_unit,data_type,validated,validation_type,validation_methods,min_accuracy_pc,max_accuracy_pc,validation_ref,stage2_comments,stage_2_pass
163,ign_france_surfwat_2024,active,30/06/2024,Lucie_Perrodin,Tronçons hydrographiques - Métropole 2024 - BD Topage®,french,"The hydrographic section is the finest division of a hydrographic network. It can form a watercourse or cross a body of water. A watercourse is made up of one or more hydrographic sections. In order to ensure the continuity of the network, we can sometimes use fictitious hydrographic sections when a watercourse is interrupted in an elementary surface of a body of water or a body of water to resume a little further or use undefined hydrographic sections when a watercourse passes underground or when its geometry is not known. These nodes represent either the outlet or the source. The confluence of hydrographic sections is marked by a hydrographic node.",NA,SANDRE; Institut national de l'information géographique et forestière (IGN); Office Français de la Biodiversité (OFB),"SANDRE; Institut national de l'information géographique et forestière (IGN); Office Français de la Biodiversité (OFB); 20240424, Tronçon hydrographique, SANDRE available from : https://www.sandre.eaufrance.fr/atlas/srv/fre/catalog.search#/metadata/0943210f-9a66-4ecd-9dbb-4e3e4561f768, (accessed 30/06/2024)",2024,TRUE,SANDRE,sandre@sandre.eaufrance.f,Licence Ouverte 2.0,https://www.etalab.gouv.fr/wp-content/uploads/2017/04/ETALAB-Licence-Ouverte-v2.0.pdf,NA,https://www.sandre.eaufrance.fr/atlas/srv/fre/catalog.search#/metadata/0943210f-9a66-4ecd-9dbb-4e3e4561f768,NA,NA,FALSE,Various,France,NA,Vectors are just lines so I think it will be impossible to classify them under EFG level,FALSE,NA,NA,NA,NA,NA,NA,NA,NA,NA,NA,NA,NA,NA,NA,NA,NA,NA,NA,NA
164,inrae_france_lcov_2022,active,14/07/2024,Lucie_Perrodin,Theia OSO Land Cover Map 2021,english; french,"Knowledge of land use is necessary both as an object of study (land planning, carbon cycle), but also as a prerequisite for many analyzes of satellite images focusing on certain classes of land. land use (monitoring of agricultural vegetation for irrigation needs and yield forecasts). The upcoming availability of the Sentinel-2 time series allows us to envisage an annual operational production of land use in France, with a moderate level of detail (15 to 20 classes), and a resolution of 10 to 20 meters.","Methodological developments have started several years ago at CESBIO, and promising tests have been carried out on LANDSAT data covering the far south of France, from Bayonne to Perpignan, and on SPOT4 data (Take5). The methods were tested extensively as part of the S2 Agri project for which 12 sites around the world were treated in 2014, then 3 entire countries and 5 300*300 sites will be treated in 2016. The good rate classification target is 90%. The CES member laboratories are also leading a TOSCA project financed by the CNES in which methodological development activities are carried out (validation and adaptation for a generic nomenclature). The methods and tools developed in this framework will therefore be applicable to France. The method used being supervised, the work must be supplemented by an ambitious campaign to acquire reference data, making it possible to carry out learning and validation of the product. Contacts have been established with potential users (MEDDE SOeS, CEREMA, INRA-ODR, etc.) to establish partnerships for data provision, validation of specifications and validation of product quality. The methods developed could now benefit from support for capitalization within a prototype chain which could be delivered to Theia at the end of 2016.","Centre d’Expertise Scientifique sur l’occupation des sols (CES OSO), Cesbio, UMR Ispa, Dynafor, CNRM, UMR Tetis, IGN-Matis, Costel and Serti","Thierion, V., Vincent, A., & Valero, S. (2022). Theia OSO Land Cover Map 2021 (Version 1) [Data set]. Zenodo. https://doi.org/10.5281/zenodo.6538910",2022,TRUE,Vincent Thierion; Silvia Valero,vincent.thierion@inrae.fr; silvia.valero@cesbio.cnes.fr,Creative Commons Attribution 4.0 International. licence is version 2.0 of the Open Licence,https://theia.cnes.fr/atdistrib/documents/Licence-Theia-CNES-Sentinel-ETALAB-v2.0-en.pdf . https://etalab.gouv.fr/licence-ouverte-open-licence,https://zenodo.org/records/6538910 [dataset]; https://www.theia-land.fr/product/carte-doccupation-des-sols-de-la-france-metropolitaine/ [supporting info],https://zenodo.org/records/6538910,10.5281/zenodo.6538909.,NA,TRUE,Various,France,NA,Quite precise regarding anthropogenic and crops environments but perhaps too broad for natural environments (level of precision generally stops at the biome level),REVIEW,NA,NA,NA,NA,NA,NA,NA,NA,NA,NA,NA,NA,NA,NA,NA,NA,NA,NA,NA
165,unsw_antarc_eco_2024,active,22/07/2024,Naema_GrosDubois,Antarctic Ecosystem Inventory: Ecosystem Typology v1.0,english,"This is Antarctica’s first comprehensive ecosystem map of ice-free lands. The data comprise a spatially explicit 3-tiered hierarchical ecosystem classification with nine Major Environment Types (tier 1), 33 Habitat Complexes (tier 2) and 269 Bioregional Ecosystem Types (tier 3). These Bioregional Ecosystem Types are aligned with ‘level 4’ of the IUCN Global Ecosystem Typology (Keith et al. 2022). 

The spatial data are available in raster format (TIF) at 100 m resolution in the Polar Stereographic Projected Coordinate System (GCS_WGS_1984) for all known ice-free areas south from latitude -57.330551 decimal degrees South (pdf map shows extent of ice-free areas in relation to terrestrial ice and ice shelves). A value attribute table (VAT) provides text fields containing codes and full names for each unit in each level of the classification hierarchy and the spatial extent of tier 3 units in hectares.

Methods of development, source data and uses of the inventory are detailed by Tóth et al. (2024a). Descriptive profiles for tier 1 and 2 units are available in Tóth et al. (2024b).","Antarctica, one of the least understood natural areas on Earth, is threatened by human disturbance and climate-related changes, underscoring the imperative for biodiversity inventories to inform conservation.Antarctic ecosystems support species and genetic components of biodiversity, ecosystem services and planetary stability. Here we present Antarctica’s first comprehensive ecosystem classification and maps of ice-free land, which hosts most of the continent’s documented terrestrial and freshwater biodiversity. We shaped a tiered approach using latent variables in a factor analysis to partitioned continental-scale abiotic variation, then biotic variation represented in spatial models, and finally recognised regional-scale variation among biogeographic units. This produced a spatially explicit classification with five environment types (tier 1), 31 habitats (tier 2) and 309 regional ecosystems (tier 3) mapped at 100 m resolution and aligned with ‘level 4’ of the IUCN global ecosystem typology. This first comprehensive ecosystem inventory will support the Antarctic Treaty’s Environmental Protocol with foundational data for identifying protected areas and tracking risks to Antarctic ecosystems. It’s tiered structure and workflow accommodate data scarcity and facilitate efficient updates which promoting robustness as knowledge builds.",University of New South Wales; Australian Antarctic Division;  Monash University; Natural Environment Research Council; University of Johannesburg; Millennium Institute Biodiversity of Antarctic and Subantarctic Ecosystems (BASE); University of Pretoria; James Cook University; University of Wollongong; Queensland University of Technology;  South Australian Museum; University of Adelaide,"Tóth, A., Terauds, A., Chown, S. L., Hughes, K. A., Convey, P., Hodgson, D. A., Cowan, D. A., Gibson, J., Leihy, R. I., Murray, N. J., Robinson, S. A., Shaw, J. D., Stark, J. S., Stevens, M. I., van den Hoff, J., Wasley, J., & Keith, D. A. (2024). Antarctic Ecosystem Inventory: Spatial data for Ice-free lands v1.0 [Data set]. In in review (1.0). Zenodo.",2024,TRUE,David Keith,david.keith@unsw.edu.au,Creative Commons Attribution 4.0 International,https://creativecommons.org/licenses/by/4.0/,NA,https://zenodo.org/records/11629115,https://doi.org/10.5281/zenodo.11629115,NA,TRUE,Various,Continental,NA,NA,TRUE,NA,NA,NA,NA,NA,NA,NA,NA,NA,NA,NA,NA,NA,NA,NA,NA,NA,NA,NA
166,embrapa_amazon_lcov_2022,active,12/08/2023,Simi_Komenda,The TerraClass Project - Legal Amazonia Brazil,portuguese; english,"The results of the TerraClass Amazônia Project have been important for understanding the processes of occupation of the Amazon region, providing support for the formulation of public policies that seek to establish an occupation model based on the premises of sustainability. The consolidation and expression of the results in state and municipal databases, as well as the dissemination of spatially explicit information, have allowed the identification of the areas where the mapped classes occur, offering local governments a better understanding of the dynamics of land use and coverage in their territories.",NA,"Embrapa Digital Agriculture; INPE; Minisério da Ciência, Tecnologia e Inovação; Ministério da Agricultura e Pecuária; Governo Federal Brasil, Uniāo e réconstrução","Embrapa Digital Agriculture (2024). TerraClass Amazon Biome [dataset], available from https://www.terraclass.gov.br/download-de-dados#! (accessed 12/08/24)",2022,TRUE,Embrapa Digital agriculture,unknown,Unknown,unknown,NA,https://www.terraclass.gov.br/geoportal-aml/,NA,NA,TRUE,Various,Regional,NA,license needs to be followed up,REVIEW,NA,NA,NA,NA,NA,NA,NA,NA,NA,NA,NA,NA,NA,NA,NA,NA,NA,NA,NA
167,embrapa_cerrado_lcov_2022,active,13/08/2024,Simi_Komenda,The TerraClass Project - Cerrado Biome Brazil,portuguese; english,"The FIP Rural Landscapes project aims to strengthen the adoption of environmental conservation and restoration practices, as well as sustainable low-carbon agricultural practices in selected river basins of the Cerrado biome. It is coordinated by the Brazilian Forest Service (SFB) and the Secretariat for Innovation, Rural Development and Irrigation (SDI) of the Ministry of Agriculture and Livestock (MAPA). With resources from the Forest Investment Program (FIP), managed by the World Bank, the project is carried out by the German technical cooperation agency GIZ (Deutsche Gesellschaft für Internationale Zusammenarbeit GmbH), commissioned by the BMZ (German Ministry of Economic Cooperation and Development), by the National Rural Learning Service (SENAR), by the National Institute for Space Research (INPE/MCTI - Ministry of Science, Technology and Innovation) and by the Brazilian Agricultural Research Corporation - (Embrapa/MAPA).",NA,"Embrapa Digital Agriculture; INPE; Minisério da Ciência, Tecnologia e Inovação; Ministério da Agricultura e Pecuária; Governo Federal Brasil, Uniāo e réconstrução","Embrapa Digital Agriculture (2024.) TerraClass Cerrado Biome [dataset], available from https://www.terraclass.gov.br/download-de-dados (accessed 13/08/24)",2022,TRUE,Embrapa Digital agriculture,unknown,Unknown,unknown,NA,https://www.terraclass.gov.br/geoportal-cerrado/,NA,NA,TRUE,Various,regional,NA,license needs to be followed up,REVIEW,NA,NA,NA,NA,NA,NA,NA,NA,NA,NA,NA,NA,NA,NA,NA,NA,NA,NA,NA
168,inpe_cerrado_veg_2021,active,13/08/2024,Simi_Komenda,Vegetation in the Cerrado Biome,portuguese,"Mapping of Cerrado vegetation from Landsat images from 2004. Hybrid classification methodology, developed through the combination of unsupervised classification and supervised classification. Land cover classes from the Cerrado phytophysiognomies proposed by Ribeiro and Walter (1998), with additions from other classes. The map's working space includes the ecoregions proposed by Sano et al. (2019), adapted to the current limit of Biomes.",NA,TerraBrasilis - INPE,"TerraBrasilis - INPE (2021). Vegetation in the Cerrado Biome (dataset), available from: https://terrabrasilis.dpi.inpe.br/geonetwork/srv/por/catalog.search#/metadata/963a7330-9b3a-4e83-bd8b-05d4778a3a66 (accessed 13/08/2024)",2021,TRUE,Dalton Valeriano,dalton.valeriano@inpe.br,CC BY-SA 4.0,https://creativecommons.org/licenses/by-sa/4.0/deed.en,NA,https://terrabrasilis.dpi.inpe.br/geonetwork/srv/por/catalog.search#/metadata/963a7330-9b3a-4e83-bd8b-05d4778a3a66,NA,NA,REVIEW,Various,Regional,NA,GET alignment review required,REVIEW,NA,NA,NA,NA,NA,NA,NA,NA,NA,NA,NA,NA,NA,NA,NA,NA,NA,NA,NA
169,wrig_global_lcov_2022,active,13/08/2024,Simi_Komenda,Dynamic World V1,english,"Dynamic World is a 10m near-real-time (NRT) Land Use/Land Cover (LULC) dataset that includes class probabilities and label information for nine classes.
Dynamic World predictions are available for the Sentinel-2 L1C collection from 2015-06-27 to present. The revisit frequency of Sentinel-2 is between 2-5 days depending on latitude. Dynamic World predictions are generated for Sentinel-2 L1C images with CLOUDY_PIXEL_PERCENTAGE <= 35%. Predictions are masked to remove clouds and cloud shadows using a combination of S2 Cloud Probability, Cloud Displacement Index, and Directional Distance Transform.",NA,World Resources Institute Google,"Brown, C.F., Brumby, S.P., Guzder-Williams, B. et al. Dynamic World, Near real-time global 10 m land use land cover mapping. Sci Data 9, 251 (2022). doi:10.1038/s41597-022-01307-4",2022,TRUE,unknown,unknown,CC BY 4.0,https://creativecommons.org/licenses/by/4.0/,NA,https://developers.google.com/earth-engine/datasets/catalog/GOOGLE_DYNAMICWORLD_V1#description,https://doi.org/10.1038/s41597-022-01307-4,NA,FALSE,Various,Global,NA,Classification scheme too broad to crosswalk to EFG level,FALSE,NA,NA,NA,NA,NA,NA,NA,NA,NA,NA,NA,NA,NA,NA,NA,NA,NA,NA,NA
170,glad_global_lcov_2022,active,28/07/2024,Lucie_Perrodin,Global Land Cover and Land Use 2000 and 2020,english,"The Intergovernmental Panel on Climate Change (IPCC) provides guidance on reporting areal extent and change of land cover and land use, requiring the use of estimators that neither over or underestimate dynamics to the degree possible, and that have known uncertainties. The maps provided by GLAD do not have these properties. However, the maps can be leveraged to facilitate appropriate probability-based statistical methods in deriving statistically valid areas of forest extent and change. Specifically, the maps may be used as a stratifier in targeting forest extent and/or change by a probability sample. The team at GLAD has demonstrated such approaches using the GLAD forest loss data in sample-based area estimation (Tyukavina et al., ERL, 2018, Turubanova et al., ERL, 2019, and Potapov et al., RSE, 2019, among others).","Recent advances in Landsat archive data processing and characterization enhanced our capacity to map land cover and land use globally with higher precision, temporal frequency, and thematic detail. Here, we present the first results from a project aimed at annual multidecadal land monitoring providing critical information for tracking global progress towards sustainable development. The global 30-m spatial resolution dataset quantifies changes in forest extent and height, cropland, built-up lands, surface water, and perennial snow and ice extent from the year 2000 to 2020. Landsat Analysis Ready Data served as an input for land cover and use mapping. Each thematic product was independently derived using locally and regionally calibrated machine learning tools. Thematic maps validation using a statistical sample of reference data confirmed their high accuracy (user’s and producer’s accuracies above 85% for all land cover and land use themes, except for built-up lands). Our results revealed dramatic changes in global land cover and land use over the past 20 years. The bitemporal dataset is publicly available and serves as a first input for the global land monitoring system. To share location copy URL.","Global Land Analysis and Discovery Lab, University of Maryland; World Resources Institute ; Texas Tech University","P.V. Potapov, M.C. Hansen, A.H. Pickens, A. Hernandez-Serna, A. Tyukavina, S. Turubanova, V. Zalles, X. Li, A. Khan, F. Stolle, N. Harris, X.-P. Song, A. Baggett, I. Kommareddy, A. Komareddy (2022).",2022,TRUE,Peter Potapov,potapov@umd.edu,CC BY 4.0 DEED,Deed - Attribution 4.0 International - Creative Commons,https://storage.googleapis.com/earthenginepartners-hansen/GLCLU2000-2020/v2/download.html [dataset]; https://www.frontiersin.org/journals/remote-sensing/articles/10.3389/frsen.2022.856903/full [supporting publication],https://storage.googleapis.com/earthenginepartners-hansen/GLCLU2000-2020/v2/download.html,https://doi.org/10.3389/frsen.2022.856903,NA,FALSE,Various,Global,NA,Classification scheme too broad to crosswalk to EFG level,REVIEW,NA,NA,NA,NA,NA,NA,NA,NA,NA,NA,NA,NA,NA,NA,NA,NA,NA,NA,NA
171,gfw_global_plant_2024,active,25/06/2024,Naema_GrosDubois,Spatial Database of Planted Trees (SDPT) Version 2.0,english,"The Spatial Database of Planted Trees (SDPT) aims to spatially differentiate planted forests and tree crops from natural and seminatural forests on a global scale. For the purposes of this technical note, we define “planted trees” as encompassing “planted forests,” which are defined as stands of planted trees—other than tree crops—grown for wood and wood fiber production or for ecosystem protection against wind and/or soil erosion, and “tree crops,” defined as stands of perennial trees for agricultural purposes. The objective of this technical note is to update the previously published SDPT in three areas: boundaries, to spatially differentiate planted trees on a global scale; tree species information, to help screen for the illegal exportation of timber products; and carbon sequestration rates, or removal factors, to improve maps of atmospheric carbon dioxide sequestration by planted trees.

Key Findings:
Based on data compiled in SDPT version 2.0 (v2.0), in 2020 there were approximately 264 million hectares of planted forests worldwide, or 6.5 percent of total tree cover. An additional 65 million hectares were mapped as tree crops.
SDPT v2.0 planted forest area represents 90 percent of the world’s total planted forest area in 2020, as reported by FAO (2020).
Newly calculated removal factors for planted forests ranged from 0.43 to 15 metric tonnes aboveground carbon per hectare per year (t C/ha/yr), while for tree crops they ranged from 0.43 to 11 t C/ha/yr.","The online Global Forest Watch (GFW) platform has become essential to how the international community understands and interacts with geospatial forest information. While most policy frameworks and private sector commitments refer to monitoring “forests” or “natural forests,” GFW monitors global “tree cover” and “tree cover change.” “Tree cover” as identified by Hansen et al. (2013) and Potapov et al. (2022) on the GFW platform includes natural and planted forests, as well as other tree crops that are not typically considered forest. For the purposes of this technical note, we define “planted trees” as encompassing “planted forests,” which are defined as stands of planted trees—other than tree crops—grown for wood and wood fiber production or for ecosystem protection against wind and/or soil erosion, and “tree crops,” defined as stands of perennial trees for agricultural purposes. The objective of this technical note is to update the previously published Spatial Database of Planted Trees (SDPT) in three areas: boundaries, to spatially differentiate planted forests and tree crops from natural and seminatural forests on a global scale; tree species information, to help screen for the illegal exportation of timber products; and carbon sequestration rates, or removal factors, to improve maps of atmospheric carbon dioxide sequestration by planted trees.1 Based on data compiled in SDPT version 2.0 (v2.0), in 2020 there were approximately 264 million hectares of planted forests worldwide, or 6.5 percent of total tree cover. An additional 65 million hectares were mapped as tree crops. Newly calculated removal factors for planted forests ranged from 0.43 to 15 metric tonnes aboveground carbon per hectare per year (t C/ha/yr), while for tree crops they ranged from 0.43 to 11 t C/ha/yr.",Global Forest Watch; World Resources Institute,"Richter, J., E. Goldman, N. Harris, D. Gibbs, M. Rose, S. Peyer, S. Richardson, and H. Velappan. 2024. “Spatial Database of Planted Trees (SDPT Version 2.0).” [dataset]. Washington, DC: World Resources Institute",2024,TRUE,Jessica Richter,jessica.richter@wri.org,"Dataset not yet available on GFW website - once available, it will be CC BY 4.0",https://data.globalforestwatch.org/pages/data-policy,https://aus01.safelinks.protection.outlook.com/?url=https%3A%2F%2Fgfw-files.s3.amazonaws.com%2Fplantations%2FSDPT_2.0%2Fsdpt_v2_v11282023.gdb.zip&data=05%7C02%7Cnaema.grosdubois%40jcu.edu.au%7C3e479b092dd4449effdf08dc95127043%7C30a8c4e81ecd4f148099f73482a7adc0%7C0%7C0%7C638549154101223266%7CUnknown%7CTWFpbGZsb3d8eyJWIjoiMC4wLjAwMDAiLCJQIjoiV2luMzIiLCJBTiI6Ik1haWwiLCJXVCI6Mn0%3D%7C0%7C%7C%7C&sdata=L7sTPpVKwITubug25MjxD5Hm%2BA%2F%2FP72Eof%2F7lYWCeCQ%3D&reserved=0   [data download link],NA,NA,NA,TRUE,T7.3,Global,NA,"Dataset not yet available online at GFW website, but will become available soon in a similar form to the SDPT v1.",TRUE,NA,NA,NA,NA,NA,NA,NA,NA,NA,NA,NA,NA,NA,NA,NA,NA,NA,NA,NA
172,gfw_stham_soy_2022,active,12/08/2024,Naema_GrosDubois,Soy Planted Area,english,"This data set provides a spatially-explicit overview of the annual planted area of soybean cultivation across South America’s agricultural frontiers, as described in Song et. al. (2021). Data is available annually from 2000 to 2022 at a 30m spatial resolution for the following biomes: Amazonia, Atlantic Forest, Caatinga, Cerrado, Chaco, Chiquitania, Pampas, and Pantanal.

Song et. al. (2021) integrates long-term satellite imagery with three years of continent-wide field observations to produce annual maps of soybean cultivation. Researchers collected Landsat and MODIS imagery for November 1 through April 30 of each growing season and created 16-day time-series with phenological metrics. These metrics were combined with data on elevation, slope, and aspect and training data from 225 sampling areas to develop soybean probability maps for each year. The field observations were then used to assess the accuracy of the resulting maps, which are constrained to match the areas of field observations.",NA,Global Forest Watch; University of Maryland; INPE Brazil; State University of New York; Universidad de Buenos Aires; Buenos Aires Grain Exchange; Companhia Nacional de Abastecimento Brasilia,"Song, XP., Hansen, M.C., Potapov, P. et al. (2022) Soy Planted Area [dataset], Global Forest Watch, available from: https://data.globalforestwatch.org/datasets/gfw::soy-planted-area-/about (accessed 12/08/2024)",2022,TRUE,Michelle Sims (WRI),michelle.sims@wri.org,CC BY,TBC,NA,https://data.globalforestwatch.org/datasets/gfw::soy-planted-area-/about,NA,NA,TRUE,T7.1,Continental,NA,Licence needs to be followed up,TRUE,NA,NA,NA,NA,NA,NA,NA,NA,NA,NA,NA,NA,NA,NA,NA,NA,NA,NA,NA
173,glad_global_forest_2018,active,28/07/2024,Lucie_Perrodin,Primary Humid Tropical Forests,english,"Primary humid tropical forests provide numerous global ecosystem services, but are under continuing threat of clearing from economic drivers. To facilitate national land use planning and balancing the goals of economic development and maintenance of ecosystem services, a primary humid tropical forest map was created by the UMD GLAD team. The primary forest extent was mapped for the year 2001 at a spatial resolution of 30 meters using globally acquired, free-of-charge, and consistently processed Landsat imagery.",NA,"Global Land Analysis and Discovery Lab, University of Maryland","Turubanova S., Potapov P., Tyukavina, A., and Hansen M. (2018) Ongoing primary forest loss in Brazil, Democratic Republic of the Congo, and Indonesia. Environmental Research Letters.",2018,TRUE,Matthew C Hansen,mhansen@umd.edu,CC BY 3.0 DEED,Deed - Attribution 3.0 Unported - Creative Commons,NA,https://glad.umd.edu/dataset/primary-forest-humid-tropics,https://doi.org/10.1088/1748-9326/aacd1c,NA,TRUE,Various,Global,NA,NA,TRUE,NA,NA,NA,NA,NA,NA,NA,NA,NA,NA,NA,NA,NA,NA,NA,NA,NA,NA,NA
174,syke_finland_eco_2018b,active,27/06/2024,Naema_GrosDubois,LuTU2018 subsets - lakes and northern forests of Finland,finnish,TBC,NA,Finnish Environment Institute (SYKE),TBC,2018,FALSE,Tytti Kontula,Tytti.Kontula@syke.fi,CC BY 4.0,https://creativecommons.org/licenses/by/4.0/deed.en,LuTU2018_Nick.zip,NA,NA,NA,TRUE,Various,Finland,TRUE,NA,TRUE,NA,NA,NA,NA,NA,NA,NA,NA,NA,NA,NA,NA,NA,NA,NA,NA,NA,NA,NA
