Source_ID,data_id_code,search_type,entry_date,analyst_id,title,language,abstract,detailed_description,provider,dataset_citation,published_year,data_public,contact_name,contact_email,licence,licence_link,private_dataset_link,URL,DOI,...21,GET_alignment_firstpass,GET_efg_tag,domain_class,nationally_endorsed,stage1_comments,stage_1_pass,documentation_provided,year_start,year_end,band_layer_name,n_map_classes,file_type,vector_raster,min_source_resolution,max_source_resolution,minimum_mapping_unit,data_type,validated,validation_type,validation_methods,min_accuracy_pc,max_accuracy_pc,validation_ref,stage2_comments,stage_2_pass
258,usey_seychelle_habitat_2014,active,26/03/2025,Tina_Corradi,"Mapping Seychelles habitat-types on Mahé, Praslin, Silhouette, La Digue and Curieuse",english,"The Seychelles vegetation has been relatively poorly studied and vegetation maps have been designed mostly with a focus on forestry and/or land use. The current study aims at improving knowledge on the types of terrestrial ecosystems present in Seychelles, their geographical distribution and their state of conservation, as a basis for the study of biodiversity and conservation patterns integrating species and ecosystem levels. A conceptual framework is presented (p.6-33) which integrates habitat-types within levels of organization of biodiversity and through different time scales. This allows to define types of ecosystems and to study their dynamics (especially their biotic variability) at a global scale (across continents, i.e. chorology) and through time (chronology). Terminology is reviewed according to international standards, with several improvements. Cartographic outputs are based on the concept of hierarchical mapping, i.e. where several thematic maps can be combined in different ways in order to produce different outputs according to specific needs. These thematic maps are produced based on a combination of methods, including modelling, field data, visual interpretation and supervised classification of remotely sensed images, and other GIS processes. The main output is a map of habitat-types which presents 31 classes (Figure 22, p.58). That map models the main environmental constraints (limiting factors) to which species have to adapt (even exotic species). Several other thematic maps allow assessing the conservation state of these habitat-types based on the current vegetation physiognomy, ecosystem development stage and naturalness. Finally, a simplified map of land cover types is proposed based on a combination of these thematic maps, or factors, and constitutes the second most important map result (Figure 24b, p. 62). Maps for all islands are provided in Annex 2. Ecosystem richness is the highest on Mahé and Silhouette, the former being also the most impacted by humans (8% natural) while the latter is the least impacted (51% natural). Naturalness is increasing with elevation: 9% in lowland, 19% in submontane, 46% in lower montane and 96% in tree fern lower montane belts (Table 10). Most of the coastal habitat-types have almost completely been transformed. The total current forest cover is estimated to ca. 10126 ha for the 5 islands (Annex 3). Anthropic lands cover ca. 6526 ha. Highly degraded bare soils represent 130 ha, mostly on Praslin (90 ha) and Curieuse (36 ha) (Table 10, p.67). Recommendations are provided for further developments of biodiversity knowledge at ecosystem level and for further valorisation of the current study (see p.64-65, 68).",NA,University of Seychelles Island Biodiversity & Conservation center; Government of Seychelles; United Nations Development Programme,"Senterre B. & Wagner M. 2014. Mapping Seychelles habitat-types on Mahé, Praslin, Silhouette, La Digue and Curieuse. Consultancy Report, Government of Seychelles, United Nations Development Programme, Victoria, Seychelles, 124 pp.",2014,FALSE,"Authors (Bruno Senterre, Michael Wagner); Betty Seraphine;  Andrew GrieserJohns",bsenterre@gmail.com; bettyseraphine1@hotmail.com; a.grieserjohns@pcusey.sc,NA,NA,NA,10.13140/RG.2.1.4558.6009,10.13140/RG.2.1.4558.6009,NA,TRUE,Various,Seychelles,TRUE,Data not publicly available. On Falko's radar already.,REVIEW,NA,NA,NA,NA,NA,NA,NA,NA,NA,NA,NA,NA,NA,NA,NA,NA,NA,NA,NA
259,mbg_kouilou_habitat_2017,active,26/03/2025,Tina_Corradi,Maping habitat-types in south-east Kouilou (Republic of Congo),english,"The principal aim of this study was to provide with baseline biodiversity data that can be used for a retrospective quantification of habitat loss over time as part of its contract to undertake targeted surveys of priority species, prioritize and map biodiversity risks,and inform mitigation planning to assist Eni Congo for the biodiversity component of it soil extraction activities in the region near Pointe Noire (Kouilou, Republic of Congo).The method used is based on an approach that combine sand integrates information on the two most basic levels of 'biodiversity', i.e. species and ecosystems,throughout the study. One of the key resultsis a map that indicates integrated biodiversity conservation priorities (FigureA, reproduced from Figure 31of the report),in which the darkestred areas have the highest ecosystemic value and larger blue points indicate the known occurrence of potentially threatened plant speciesi.e., those that are potentially Critically Endangered (CR) and potentially Endangered (EN).",NA,"Missouri Botanical Garden, Africa and Madagascar Department; University of Seychelles","Senterre, B., Bidault, E., Stévart, T., Wagner, M., & Lowry, P. (2017). Mapping habitat-types in south-east Kouilou (Republic of Congo). Missouri Botanical Garden (MBG), Africa and Madagascar Department, St. Louis, Missouri, USA (Consultancy Report).",2017,FALSE,Tariq Stevart ; Bruno Senterre,tariq.stevart@mobot.org; bsenterre@gmail.com,NA,NA,NA,https://www.dropbox.com/scl/fi/zlpp8119eiu09rnqx6waj/Senterre-et-al-2017-Maping-habitat-types-in-Congo-Kouilou-WCS-MBG-01.pdf?rlkey=2c76pcm6v9q7ycm8od0qa5t7b&dl=0,NA,NA,TRUE,Various,Regional,NA,In the report I could not find any license permission or dataset pubblication. Neet follow up email,REVIEW,NA,NA,NA,NA,NA,NA,NA,NA,NA,NA,NA,NA,NA,NA,NA,NA,NA,NA,NA
260,uct_araucania_forest_2021,active,10/04/2025,Tina_Corradi,"Trees, shrubs and herbs of the coastal Myrtaceae swamp forest (Región de La Araucanía, Chile): a dataset",english,"Species lists are fundamental for knowledge of species diversity in regions subject to intense anthropogenic pressure, especially in poorly-studied ecosystems. The dataset comes from an inventory conducted in 30 fragments of Myrtaceae swamp forest, located in an agroforestry matrix landscape of the coastal La Araucanía Region in Chile. The data collection was carried out using line transect sampling, which was traced through the core of each fragment orientated towards its longest axis. The dataset provides a record of 55 species (24 trees, 1 vine [as a host], 16 herbs and 15 shrubs) including accidental epiphytes (n = 7), hemiparasites (n = 4), host (n = 10) and additionally woody debris (n = 36). The most frequent trees in the landscape were Myrceugenia exsucca (n = 36 records) and Blepharocalyx cruckshanksii (n = 33 records), species that were also the most common hosts. Drimys winteri was a companion species, other trees and shrubs generally being rarely observed, as was the case of the introduced species (Prunus avium, Rubus constrictus and Ulex europaeus). Branches were the most common microhabitat for hemiparasites. Within this group, Lepidoceras chilense was the most frequent species. For accidental epiphytes, Drimys winteri, which commonly grows on the ground (soil), were the most common species found in the main trunk crotch. Some unusual observations were the climber Cissus striata as host of Tristerix corymbosus (hemiparasite) and Tristerix corymbosus as host of Lepidoceras chilense (hemiparasite).","This study represents a landscape-scale sample of the swamp forest, which is distributed in a dispersed pattern over a large stretch of Chile. The data were collected from 30 forest patches (from 0.05 to 936 ha), located on the coast of the Araucanía. The database includes the presence of 55 species of vascular plants in 356 records. The main novelty of this contribution is the systematic classification of species under six traits, never before reported in the same database: (i) condition (coarse woody debris, fallen log, live, snag), (ii) habit (herb, shrub, tree), (iii) growth microhabitat (e.g. tree trunk, branch, main trunk crotch), (iv) growth form (accidental epiphyte, hemiparasite, terricolous, vegetative), (v) host species (as appropriate) and (vi) relative location of the species in the sampled patch and surrounding areas (core, border, matrix). Species not previously observed in these forests were: Gavilea spp., Hieracium spp., Lophosoria quadripinnata, Berberis actinacantha, Gaultheria phillyreifolia, Ovidia pillo-pillo, Amomyrtus meli and Caldcluvia paniculata. In addition, two introduced species are novelties for the catalogue of vascular plants of Chile (Cupressus macrocarpa and Prunus avium). Several of these ecosystem traits are indeed new reports for these types of forests (e.g. accidental epiphytes, fallen logs, species-host relationship); at the same time, more frequent data (i.e. species composition, habit) are found in different contributions, making the comprehensive process of analysis difficult.",Universidad Católica de Temuco,"Pincheira-Ulbrich J, Andrade Mansilla E, Peña-Cortés F, Vergara Fernández C. Trees, shrubs and herbs of the coastal Myrtaceae swamp forest (Región de La Araucanía, Chile): a dataset. Biodivers Data J. 2021 Mar 1;9:e63634. doi: 10.3897/BDJ.9.e63634. PMID: 33692648; PMCID: PMC7940323.",2021,TRUE,Jimmy Pincheira-Ulbrich,jpincheira@uct.cl,Creative Commons Public Domain Waiver (CC-Zero),https://pmc.ncbi.nlm.nih.gov/articles/PMC7940323/#sec17,NA,https://pmc.ncbi.nlm.nih.gov/articles/PMC7940323/#_ad93_,NA,NA,TRUE,Various,Regional,NA,"Dataset of records of plants in a csv format file on excell, with x,y coordinates, no map",FALSE,NA,NA,NA,NA,NA,NA,NA,NA,NA,NA,NA,NA,NA,NA,NA,NA,NA,NA,NA
261,izl_greenland_marine_2017,active,16/04/2025,Tina_Corradi,Mapping and classifying the seabed of the West Greenland continental shelf,english,"Marine benthic habitats support a diversity of marine organisms that are both economically and intrinsically valuable. Our knowledge of the distribution of these habitats is largely incomplete, particularly in deeper water and at higher latitudes. The western continental shelf of Greenland is one example of a deep (more than 500 m) Arctic region with limited information available. This study uses an adaptation of the EUNIS seabed classification scheme to document benthic habitats in the region of the West Greenland shrimp trawl fishery from 60°N to 72°N in depths of 61–725 m. More than 2000 images collected at 224 stations between 2011 and 2015 were grouped into 7 habitat classes. A classification model was developed using environmental proxies to make habitat predictions for the entire western shelf (200–700 m below 72°N). The spatial distribution of habitats correlates with temperature and latitude. Muddy sediments appear in northern and colder areas whereas sandy and rocky areas dominate in the south. Southern regions are also warmer and have stronger currents. The Mud habitat is the most widespread, covering around a third of the study area. There is a general pattern that deep channels and basins are dominated by muddy sediments, many of which are fed by glacial sedimentation and outlets from fjords, while shallow banks and shelf have a mix of more complex habitats. This first habitat classification map of the West Greenland shelf will be a useful tool for researchers, management and conservationists.",NA,Institute of Zoology London; Greenland Institute of Natural Resources,"S. Gougeon, K.M. Kemp, M.E. Blicher, C. Yesson (2017) Mapping and classifying the seabed of the West Greenland continental shelf, Estuarine, Coastal and Shelf Science, Volume 187, Pages 231-240, ISSN 0272-7714",2017,TRUE,Chris Yesson,chris.yesson@ioz.ac.uk,Unknown,NA,NA,https://www.sciencedirect.com/science/article/pii/S027277141730063X#sec1,https://doi.org/10.1016/j.ecss.2017.01.009,NA,TRUE,Various,Regional,NA,License review required,REVIEW,NA,NA,NA,NA,NA,NA,NA,NA,NA,NA,NA,NA,NA,NA,NA,NA,NA,NA,NA
262,bccr_circumpolar_soil_2018,active,15/04/2025,Tina_Corradi,The Northern Circumpolar Soil Carbon Database: spatially distributed datasets of soil coverage and soil carbon storage in the northern permafrost regions,english,"The Northern Circumpolar Soil Carbon Database (NCSCD) is a geospatial database created for the purpose of quantifying storage of organic carbon in soils of the northern circumpolar permafrost region. The spatial base of the NCSCD is a polygon database describing soils in the northern circumpolar permafrost regions. The database was compiled by combining and homogenizing several regional/national soil maps. To calculate storage of soil organic carbon, these soil maps have been linked to field-data on soil organic carbon storage from a total of 1,647 sites from around the circumpolar permafrost region. The NCSCD contains information on fractions of coverage of different soil types (following U.S. Soil Taxonomy nomenclature) as well as storage of soil organic carbon (kg/m2) between 0-30 cm and 0-100 cm depth. The NCSCD is available either as a polygon-based database (which is the original format) or converted to gridded data. Gridded data products are available in different spatial grid resolutions and in formats adapted for use in desktop GIS-applications and model applications.","High-latitude terrestrial ecosystems are key components in the global carbon (C) cycle. Estimates of global soil organic carbon (SOC), however, do not include updated estimates of SOC storage in permafrost-affected soils or representation of the unique pedogenic processes that affect these soils. The Northern Circumpolar Soil Carbon Database (NCSCD) was developed to quantify the SOC stocks in the circumpolar permafrost region (18.7 × 106 km2). The NCSCD is a polygon-based digital database compiled from harmonized regional soil classification maps in which data on soil order coverage have been linked to pedon data (n = 1778) from the northern permafrost regions to calculate SOC content and mass. In addition, new gridded datasets at different spatial resolutions have been generated to facilitate research applications using the NCSCD (standard raster formats for use in geographic information systems and Network Common Data Form files common for applications in numerical models). This paper describes the compilation of the NCSCD spatial framework, the soil sampling and soil analytical procedures used to derive SOC content in pedons from North America and Eurasia and the formatting of the digital files that are available online. The potential applications and limitations of the NCSCD in spatial analyses are also discussed.","Bolin Centre for Climate Research, Stockholm University",Bolin Centre for Climate Research. (2018). Archived data from Northern Circumpolar Soil Carbon Database (1.0). Stockholm University. Available at: https://doi.org/10.5879/ecds/00000001,2018,TRUE,"G. Hugelius, C.Tarnocai, G. Broll, J. G. Canadell, P. Kuhry, D.K Swanson",NA,Unknown,https://researchdata.se/en/catalogue/dataset/ecds0148-1,NA,https://essd.copernicus.org/articles/5/3/2013/,doi:10.5879/ecds/00000001,NA,FALSE,Various,Regional,NA,NA,FALSE,NA,NA,NA,NA,NA,NA,NA,NA,NA,NA,NA,NA,NA,NA,NA,NA,NA,NA,NA
263,upf_moorea_forests_2012,active,16/04/25,Tess_Harmer,Support vector machines to map rare and endangered native plants in Pacific islands forests.,english,"It is critical to know accurately the ecological and geographic range of rare and endangered species for biodiversity conservation and management. In this study, we used support vector machines (SVM) for modeling rare species distribution and we compared it to another emerging machine learning classifier called random forests (RF). The comparison was performed using three native and endemic plants found at low- to mid-elevation in the island of Moorea (French Polynesia, South Pacific) and considered rare because of scarce occurrence records: Lepinia taitensis (28 observed occurrences), Pouteria tahitensis (20 occurrences) and Santalum insulare var. raiateense (81 occurrences). We selected a set of biophysical variables to describe plant habitats in tropical high volcanic islands, including topographic descriptors and an overstory vegetation map. The former were extracted from a digital elevation model (DEM) and the latter is a result of a SVM classification of spectral and textural bands from very high resolution Quickbird satellite imagery. Our results show that SVM slightly but constantly outperforms RF in predicting the distribution of rare species based on the kappa coefficient and the area under the curve (AUC) achieved by both classifiers. The predicted potential habitats of the three rare species are considerably wider than their currently observed distribution ranges. We hypothesize that the causes of this discrepancy are strong anthropogenic disturbances that have impacted low- to mid-elevation forests in the past and present. There is an urgent need to set up conservation strategies for the endangered plants found in these shrinking habitats on the Pacific islands.",NA,University of French Polynesia,"Pouteau, R., Meyer, J. Y., Taputuarai, R., & Stoll, B. (2012). Support vector machines to map rare and endangered native plants in Pacific islands forests. Ecological Informatics, 9, 37-46.",2012,FALSE,"Robin Pouteau, Jean-Yves Meyer, Ravahere Taputuarai, Benoît Stoll",r.pouteau@yahoo.fr,Unknown,NA,NA,https://www.sciencedirect.com/science/article/pii/S1574954112000210,https://doi.org/10.1016/j.ecoinf.2012.03.003,NA,TRUE,Various,Moorea,NA,"0.60m resolution map of Moorea's forests, cannot access data, have not yet contacted them",REVIEW,NA,NA,NA,NA,NA,NA,NA,NA,NA,NA,NA,NA,NA,NA,NA,NA,NA,NA,NA
264,atree_india_semiarid_2022,active,16/04/2025,Dhruv_Narayan,Mapping the distribution and extent of India's semi-arid open natural ecosystems,english,"Non-forested open natural ecosystems (ONEs) support high biodiversity as well as livelihoods of millions of pastoralists, but are highly threatened due to land conversion. To improve the recognition of their value, we generated a high-resolution (30 m) map of ONEs in the low elevation arid and semi-arid regions of India.

We used public datasets in the Google Earth Engine catalogue to identify and mask out pixels with non-ONE land-cover types, and biophysical attributes outside the environmental envelopes of ONEs. We used 181,812 ONE and 116,447 non-ONE training points along with the input composite image to train random forest classifiers to estimate the probability of a pixel being an ONE. We developed a series of local classifiers for each of eight regions of interest and created a mask of pixels with ≥50% probability of being an ONE.",NA,"Ashoka Trust for Research in Ecology and the Environment, Bengaluru, Karnataka, India","Madhusudan, M. D., and A. T. Vanak. 2022. “Mapping the Distribution and Extent of India's Semi-Arid Open Natural Ecosystems.” Journal of Biogeography 50(8): 1–11. https://doi.org/10.1111/jbi.14471.",2022,TRUE,"M. D. Madhusudan, Abi Tamim Vanak",avanak@atree.org,Custom,NA,NA,https://onlinelibrary.wiley.com/doi/full/10.1111/jbi.14471,https://doi.org/10.1111/jbi.14471,NA,FALSE,T5.1; T5.2,India,NA,Classification scheme too broad,FALSE,NA,NA,NA,NA,NA,NA,NA,NA,NA,NA,NA,NA,NA,NA,NA,NA,NA,NA,NA
265,przht_france_mangrove_2023,active,16/04/2025,William_Masson,CARNAMA V2 (cartographie nationale des mangroves des outre-mer français),english; french,"The CARNAMA project, carried out on behalf of the IFRECOR (French Coral Reef Initiative) in 2020, made it possible to map the French mangroves unprecedentedly reached (except in territories where the area is minimal). This was made possible thanks to recent and significant advances in satellite imagery, and in particular the launch of the Sentinel sensor series as part of the European Space Agency’s Copernicus programme.",NA,Pôle-relais zones humides tropicales (PRZHT); Comité français de l’UICN; Initiative Française pour les Récifs Coralliens (IFRECOR),"Pôle-relais zones humides tropicales (2023), CARNAMA V2 (cartographie nationale des mangroves des outre-mer français), available from: https://www.pole-tropical.org/actions/les-actions-du-reseau-dobservation-des-mangroves/2023-une-nouvelle-version-de-carnama-pour-les-membres-du-rom/ (accessed 16/04/2025)",2023,TRUE,Gaelle Vandersarren,gaelle.vandersarren@uicn.fr,Custom,https://www.pole-tropical.org/a-propos/mentions-legales/,NA,https://www.pole-tropical.org/actions/les-actions-du-reseau-dobservation-des-mangroves/2023-une-nouvelle-version-de-carnama-pour-les-membres-du-rom/,NA,NA,TRUE,MFT1.2,Regional,NA,Already integrated into the Global Mangrove Watch database,REVIEW,NA,NA,NA,NA,NA,NA,NA,NA,NA,NA,NA,NA,NA,NA,NA,NA,NA,NA,NA
266,uah_belize_mangrove_2020,active,16/04/2025,Rebecca_Saunders,"Use of public Earth Observation data for tracking progress in sustainable management of coastal forest ecosystems in Belize, Central America",english,"This dataset depicts Belize's national mangrove cover for the period November 1980 through February 2017, based on the ~1990 baseline established by Simon Zisman. The dataset was developed by using satellite imagery to detect where how mangrove cover has changed between 1980 and 2017. The source data for this effort include Landsat-3 Multispectral Scanner (MSS) imagery, Landsat-5 Thematic Mapper (Landsat TM) imagery, Landsat-7 Enhanced Thematic Mapper Plus (Landsat ETM+) imagery, and Landsat-8 Operational Land Imager (OLI) imagery. A full description of the process by which the data were generated is provided in “Use of public Earth Observation data for tracking progress in sustainable management of coastal forest ecosystems in Belize, Central America,” by Cherrington et al.",NA,Univrsity of Alabama in Huntsville,"Cherrington, Emil (2020), “Data for: Use of public Earth Observation data for tracking progress in sustainable management of coastal forest ecosystems in Belize, Central America”, Mendeley Data, V1, doi: 10.17632/2fzbnpnsdp.1",2020,TRUE,Emil Cherrington,emil.cherrington@nasa.gov,CC BY 4.0,https://creativecommons.org/licenses/by/4.0/,NA,https://data.mendeley.com/datasets/2fzbnpnsdp/1,10.17632/2fzbnpnsdp.1,NA,TRUE,MFT1.2,Belize,NA,"Mapped by mangrove cover type (tall mangrove, dwarf mangrove, mangrove savanna, etc) using 30m resolution LANDSAT data",TRUE,NA,NA,NA,NA,NA,NA,NA,NA,NA,NA,NA,NA,NA,NA,NA,NA,NA,NA,NA
267,usgs_oceania_terrestrial_2012,active,16/04/2025,Tess_Harmer,"The islands of Oceania – Political geography, biogeography, and terrestrial ecosystems",english,"Free-flowing rivers (FFRs) support diverse, complex and dynamic ecosystems globally, providing important societal and economic services. Infrastructure development threatens the ecosystem processes, biodiversity and services that these rivers support. Here we assess the connectivity status of 12 million kilometres of rivers globally and identify those that remain free-flowing in their entire length. Only 37 per cent of rivers longer than 1,000 kilometres remain free-flowing over their entire length and 23 per cent flow uninterrupted to the ocean. Very long FFRs are largely restricted to remote regions of the Arctic and of the Amazon and Congo basins. In densely populated areas only few very long rivers remain free-flowing, such as the Irrawaddy and Salween. Dams and reservoirs and their up- and downstream propagation of fragmentation and flow regulation are the leading contributors to the loss of river connectivity. By applying a new method to quantify riverine connectivity and map FFRs, we provide a foundation for concerted global and national strategies to maintain or restore them.",NA,U.S. Geological Survey,"Pouteau, R., Meyer, J. Y., Taputuarai, R., & Stoll, B. (2012). Support vector machines to map rare and endangered native plants in Pacific islands forests. Ecological Informatics, 9, 37-46.",2012,FALSE,Roger Sayre,rsayre@usgs.gov,available in the public domain',NA,NA,https://www.sciencedirect.com/science/article/pii/S2212041619303742#ab005,https://doi.org/10.1016/j.ecoser.2019.100985,NA,REVIEW,Various,Oceania,NA,"High res (30m) map of all the islands of Oceania, an example is given of New Caledonia with detailed description of land use/ forest data. Link to open access data is NOT working",REVIEW,NA,NA,NA,NA,NA,NA,NA,NA,NA,NA,NA,NA,NA,NA,NA,NA,NA,NA,NA
